{
  "schema_version": "1.0.0",
  "kind": "validation_receipt",
  "decapod_release": "0.107.0",
  "git_revision": "987a0c8ac78a7399620d52021f169d70ab83a1c8",
  "repo_signal_fingerprint": "5e522c585e055cae81578f96df9ab41a4f21f6fde8c73b68ca9d0f2be05870d4",
  "trajectory_run_id": "musl-publication",
  "trajectory_artifact_hash": "sha256:32e91b988b2cd6b9a64409cf92e183312c7aaeb88a53bd27865faaf19d463d1b",
  "validation_epoch": {
    "schema_version": "1.0.0",
    "epoch_id": "ve_55410c03d82c10cf",
    "evaluator_identity": "decapod-validate@0.107.0",
    "evaluator_set_hash": "sha256:bd25c3fafdb6a2983affa81899f5bd72fca81a3e80af85aae36f7e81801ec1f9",
    "constitution_version": "embedded-docs@0.107.0",
    "constitution_hash": "sha256:b618953bef49418a14f46d36fa77bcaa4e477de0f82e9765fac769d61bb97445",
    "validation_profile": "default",
    "validation_profile_hash": "sha256:37a8eec1ce19687d132fe29051dca629d164e2c4958ba141d5f4133a33f0688f",
    "proof_rubric": "decapod-validate/current-proof-v1",
    "proof_rubric_hash": "sha256:99e8ef25629da391e9b479db9fff52b82f340224f7a69d8a88d2992ae8e90466",
    "generated_specs_manifest_hash": "sha256:123a9307a26af2112dce3ff8290fdf36dc5b2e5fe29da66f5945c25850aa00eb",
    "generated_specs_fingerprint": "5e522c585e055cae81578f96df9ab41a4f21f6fde8c73b68ca9d0f2be05870d4",
    "material_hashes": {
      "constitution:core/DECAPOD": "sha256:b618953bef49418a14f46d36fa77bcaa4e477de0f82e9765fac769d61bb97445",
      "generated_spec:.decapod/managed/specs/ARCHITECTURE.md": "sha256:5336cd10407b1c9d8894e65ee2e0b9a376e2ee33e18406c34591f2ca345815ac",
      "generated_spec:.decapod/managed/specs/INTENT.md": "sha256:fbc1da17c11109454aa428817e59224f47e9629262e7f4b23c1f9aeb05c0ebc1",
      "generated_spec:.decapod/managed/specs/INTERFACES.md": "sha256:41c590591d9ee8bddc7c3591ad7cfbb3bef90f52a2f9ee18fa7f8b9b0c4aa85d",
      "generated_spec:.decapod/managed/specs/OPERATIONS.md": "sha256:04850ae88ed86fb190800bdc6aec2d9e101b150e6950b677cb8d9e2535103f12",
      "generated_spec:.decapod/managed/specs/README.md": "sha256:f06cda9fba5705e2326425d1705590745c77278696d869ba5136bdad1cf714ec",
      "generated_spec:.decapod/managed/specs/SECURITY.md": "sha256:b360c55903c93a42efb5c6310d17a6f961e8457826deb353dd8fe6761e80566a",
      "generated_spec:.decapod/managed/specs/SEMANTICS.md": "sha256:1aee5c8e80669d93dae891bdb2bca53916f5a28aa36a4530184a30ae15e22903",
      "generated_spec:.decapod/managed/specs/VALIDATION.md": "sha256:80df47d29cd98d990fa6547e075788f1e140601ce7d1f93941cc9ce83742fb2b",
      "generated_specs_fingerprint": "5e522c585e055cae81578f96df9ab41a4f21f6fde8c73b68ca9d0f2be05870d4",
      "generated_specs_manifest": "sha256:123a9307a26af2112dce3ff8290fdf36dc5b2e5fe29da66f5945c25850aa00eb",
      "governance_material:.decapod/governance/claims.json": "sha256:8f810aa7c70f812f74f283553df4094c6c4b59fbbad7d7a506d20b81a3000712",
      "governance_material:.decapod/governance/plan.json": "sha256:0b76f349be60558dccf148a991057b2e594cb69a45faee0d70ad8b10f96664ad",
      "governance_material:.decapod/managed/Dockerfile.decapod": "sha256:ae20dc58afbc469f53e2ce3468d1e579280cd1151aa042084a265ccb2d1a839c",
      "governance_material:AGENTS.md": "sha256:af077fb950da1b6ccec4f86d492e4171774513a4971f2419fd53e9d30c639bfb",
      "governance_material:CLAUDE.md": "sha256:4787e5c4a5e93fa47f02b0d90ec724efac4e54fee1e5e187a4bcd737a5e4a826",
      "governance_material:CODEX.md": "sha256:f34eea857d32dbbd81e9d87dbe4d3752e2c7f3a86072be3cf2f3434aa096d014",
      "governance_material:GEMINI.md": "sha256:8e93e449155fe5a068b7822d25216ce5187a1d69ca5d0fba2063a04decf62953",
      "living_spec_material:.decapod/managed/specs/ARCHITECTURE.md": "sha256:a4434d8df2a80b331ee1cd1f15436207f2016887928b66557d9be3a896ed3601",
      "living_spec_material:.decapod/managed/specs/INTENT.md": "sha256:d52e0c74e213c33ffc44dcfb7f058d7721a6eedced63fb43798abc5800064be7",
      "living_spec_material:.decapod/managed/specs/INTERFACES.md": "sha256:ec59736eba382f3e01ea03fd8fb7eebe415cc343a48075e6e9a91efcd238621a",
      "living_spec_material:.decapod/managed/specs/OPERATIONS.md": "sha256:92b578563477321d5bcd7ca47adeadc858a1d69d4cb75857aee42ce76d8f4227",
      "living_spec_material:.decapod/managed/specs/README.md": "sha256:0d1c10a1d51a0dee71547a726e1150fe065c04339562fb1437496e21bbc1f0dd",
      "living_spec_material:.decapod/managed/specs/SECURITY.md": "sha256:ad35c389324be26f9a505ea2561acf50ac674e263d0835724a2e9fd9783ac56f",
      "living_spec_material:.decapod/managed/specs/SEMANTICS.md": "sha256:883538b0fdc2078583f5511a48641ad350ec800a06ad7b46bdcf2234fd445583",
      "living_spec_material:.decapod/managed/specs/VALIDATION.md": "sha256:973fa1c42e5b6d500c04f5b54e6af0d59d0ae0b85a75019b2bfb966e8e7ad88f",
      "proof_rubric": "sha256:99e8ef25629da391e9b479db9fff52b82f340224f7a69d8a88d2992ae8e90466",
      "validation_profile": "sha256:37a8eec1ce19687d132fe29051dca629d164e2c4958ba141d5f4133a33f0688f"
    }
  },
  "status": "ok",
  "pass_count": 203,
  "fail_count": 0,
  "warn_count": 4,
  "elapsed_ms": 4491,
  "drift_findings": [],
  "temporary_artifacts_cleaned": 0,
  "failures": [],
  "warnings": [
    "Risk map missing (run `decapod riskmap init`)",
    "Stale workspaces preserved for explicit review: <external-path> (current_workspace: workspace contains the current process; rerun prune from the host checkout after leaving this workspace so Git can release the branch), <external-path> (active_claim: workspace belongs to an active task claim; release or complete the claim before pruning)",
    "Watcher audit trail missing (run `decapod govern watcher run`)",
    "Workspace branch 'agent/musl-promotion/bugs_01m4kqw7ww3pxbkf' has unpushed commits or does not exist on origin. Run `git push origin agent/musl-promotion/bugs_01m4kqw7ww3pxbkf`."
  ],
  "gate_timings": [
    {
      "name": "validate_machine_contract",
      "elapsed_ms": 2029
    },
    {
      "name": "validate_markdown_primitives_roundtrip_gate",
      "elapsed_ms": 517
    },
    {
      "name": "validate_project_specs_docs",
      "elapsed_ms": 475
    },
    {
      "name": "validate_stale_workspaces",
      "elapsed_ms": 285
    },
    {
      "name": "validate_obligations",
      "elapsed_ms": 155
    },
    {
      "name": "validate_legacy_jsonl_retired",
      "elapsed_ms": 102
    },
    {
      "name": "validate_schema_determinism",
      "elapsed_ms": 101
    },
    {
      "name": "validate_no_legacy_namespaces",
      "elapsed_ms": 67
    },
    {
      "name": "validate_git_workspace_context",
      "elapsed_ms": 67
    },
    {
      "name": "validate_embedded_self_contained",
      "elapsed_ms": 64
    },
    {
      "name": "validate_archive_integrity",
      "elapsed_ms": 57
    },
    {
      "name": "validate_control_plane_contract",
      "elapsed_ms": 39
    },
    {
      "name": "validate_repomap_determinism",
      "elapsed_ms": 27
    },
    {
      "name": "validate_interface_contract_bootstrap",
      "elapsed_ms": 16
    },
    {
      "name": "validate_federation_gates",
      "elapsed_ms": 16
    },
    {
      "name": "validate_knowledge_integrity",
      "elapsed_ms": 14
    },
    {
      "name": "validate_health_purity",
      "elapsed_ms": 14
    },
    {
      "name": "validate_lineage_hard_gate",
      "elapsed_ms": 12
    },
    {
      "name": "validate_policy_integrity",
      "elapsed_ms": 10
    },
    {
      "name": "validate_canon_mutation",
      "elapsed_ms": 10
    },
    {
      "name": "validate_watcher_purity",
      "elapsed_ms": 10
    },
    {
      "name": "validate_risk_map_violations",
      "elapsed_ms": 9
    },
    {
      "name": "validate_git_protected_branch",
      "elapsed_ms": 7
    },
    {
      "name": "validate_watcher_audit",
      "elapsed_ms": 5
    },
    {
      "name": "validate_override_authority",
      "elapsed_ms": 5
    },
    {
      "name": "validate_git_push_pr_gate",
      "elapsed_ms": 5
    },
    {
      "name": "validate_lcm_immutability",
      "elapsed_ms": 4
    },
    {
      "name": "validate_knowledge_promotions_if_present",
      "elapsed_ms": 4
    },
    {
      "name": "validate_lcm_rebuild_gate",
      "elapsed_ms": 4
    },
    {
      "name": "validate_entrypoint_invariants",
      "elapsed_ms": 2
    },
    {
      "name": "validate_gatekeeper_gate",
      "elapsed_ms": 2
    },
    {
      "name": "validate_database_schema_versions",
      "elapsed_ms": 2
    },
    {
      "name": "validate_generated_artifact_whitelist",
      "elapsed_ms": 2
    },
    {
      "name": "validate_health_cache_integrity",
      "elapsed_ms": 1
    },
    {
      "name": "validate_plan_governed_execution_gate",
      "elapsed_ms": 1
    },
    {
      "name": "validate_research_claims_if_present",
      "elapsed_ms": 1
    },
    {
      "name": "validate_trajectory_artifacts_if_present",
      "elapsed_ms": 1
    },
    {
      "name": "validate_heartbeat_invocation_gate",
      "elapsed_ms": 1
    },
    {
      "name": "validate_repo_map",
      "elapsed_ms": 1
    },
    {
      "name": "validate_project_config_toml",
      "elapsed_ms": 0
    },
    {
      "name": "validate_validation_receipt_if_present",
      "elapsed_ms": 0
    },
    {
      "name": "validate_spec_drift",
      "elapsed_ms": 0
    },
    {
      "name": "validate_project_scoped_state",
      "elapsed_ms": 0
    },
    {
      "name": "validate_context_capsule_policy_contract",
      "elapsed_ms": 0
    },
    {
      "name": "validate_context_capsules_if_present",
      "elapsed_ms": 0
    },
    {
      "name": "validate_state_commit_gate",
      "elapsed_ms": 0
    },
    {
      "name": "validate_workunit_manifests_if_present",
      "elapsed_ms": 0
    },
    {
      "name": "validate_docs_templates_bucket",
      "elapsed_ms": 0
    },
    {
      "name": "validate_jev_history_if_present",
      "elapsed_ms": 0
    },
    {
      "name": "validate_coplayer_policy_tightening",
      "elapsed_ms": 0
    },
    {